CPU 0:
   0x00000000 0x00: eax=0x0000000d ebx=0x756e6547 ecx=0x6c65746e edx=0x49656e69
   0x00000001 0x00: eax=0x000306a9 ebx=0x00100800 ecx=0x3dbae3bf edx=0xbfebfbff
   0x00000002 0x00: eax=0x76035a01 ebx=0x00f0b2ff ecx=0x00000000 edx=0x00ca0000
   0x00000003 0x00: eax=0x00000000 ebx=0x00000000 ecx=0x00000000 edx=0x00000000
   0x00000004 0x00: eax=0x1c004121 ebx=0x01c0003f ecx=0x0000003f edx=0x00000000
   0x00000004 0x01: eax=0x1c004122 ebx=0x01c0003f ecx=0x0000003f edx=0x00000000
   0x00000004 0x02: eax=0x1c004143 ebx=0x01c0003f ecx=0x000001ff edx=0x00000000
   0x00000004 0x03: eax=0x1c03c163 ebx=0x02c0003f ecx=0x00000fff edx=0x00000006
   0x00000004 0x04: eax=0x00000000 ebx=0x00000000 ecx=0x00000000 edx=0x00000000
   0x00000005 0x00: eax=0x00000040 ebx=0x00000040 ecx=0x00000003 edx=0x00021120
   0x00000006 0x00: eax=0x00000075 ebx=0x00000002 ecx=0x00000009 edx=0x00000000
   0x00000007 0x00: eax=0x00000000 ebx=0x00000281 ecx=0x00000000 edx=0x9c000400
   0x00000008 0x00: eax=0x00000000 ebx=0x00000000 ecx=0x00000000 edx=0x00000000
   0x00000009 0x00: eax=0x00000000 ebx=0x00000000 ecx=0x00000000 edx=0x00000000
   0x0000000a 0x00: eax=0x07300403 ebx=0x00000000 ecx=0x00000000 edx=0x00000603
   0x0000000b 0x00: eax=0x00000001 ebx=0x00000002 ecx=0x00000100 edx=0x00000000
   0x0000000b 0x01: eax=0x00000004 ebx=0x00000004 ecx=0x00000201 edx=0x00000000
   0x0000000b 0x02: eax=0x00000000 ebx=0x00000000 ecx=0x00000002 edx=0x00000000
   0x0000000c 0x00: eax=0x00000000 ebx=0x00000000 ecx=0x00000000 edx=0x00000000
   0x0000000d 0x00: eax=0x00000007 ebx=0x00000340 ecx=0x00000340 edx=0x00000000
   0x0000000d 0x01: eax=0x00000001 ebx=0x00000000 ecx=0x00000000 edx=0x00000000
   0x0000000d 0x02: eax=0x00000100 ebx=0x00000240 ecx=0x00000000 edx=0x00000000
   0x20000000 0x00: eax=0x00000007 ebx=0x00000340 ecx=0x00000340 edx=0x00000000
   0x80000000 0x00: eax=0x80000008 ebx=0x00000000 ecx=0x00000000 edx=0x00000000
   0x80000001 0x00: eax=0x00000000 ebx=0x00000000 ecx=0x00000001 edx=0x28100800
   0x80000002 0x00: eax=0x20202020 ebx=0x49202020 ecx=0x6c65746e edx=0x20295228
   0x80000003 0x00: eax=0x65726f43 ebx=0x294d5428 ecx=0x2d336920 edx=0x37313233
   0x80000004 0x00: eax=0x50432055 ebx=0x20402055 ecx=0x30382e31 edx=0x007a4847
   0x80000005 0x00: eax=0x00000000 ebx=0x00000000 ecx=0x00000000 edx=0x00000000
   0x80000006 0x00: eax=0x00000000 ebx=0x00000000 ecx=0x01006040 edx=0x00000000
   0x80000007 0x00: eax=0x00000000 ebx=0x00000000 ecx=0x00000000 edx=0x00000100
   0x80000008 0x00: eax=0x00003024 ebx=0x00000000 ecx=0x00000000 edx=0x00000000
   0x80860000 0x00: eax=0x00000007 ebx=0x00000340 ecx=0x00000340 edx=0x00000000
   0xc0000000 0x00: eax=0x00000007 ebx=0x00000340 ecx=0x00000340 edx=0x00000000
CPU 1:
   0x00000000 0x00: eax=0x0000000d ebx=0x756e6547 ecx=0x6c65746e edx=0x49656e69
   0x00000001 0x00: eax=0x000306a9 ebx=0x01100800 ecx=0x3dbae3bf edx=0xbfebfbff
   0x00000002 0x00: eax=0x76035a01 ebx=0x00f0b2ff ecx=0x00000000 edx=0x00ca0000
   0x00000003 0x00: eax=0x00000000 ebx=0x00000000 ecx=0x00000000 edx=0x00000000
   0x00000004 0x00: eax=0x1c004121 ebx=0x01c0003f ecx=0x0000003f edx=0x00000000
   0x00000004 0x01: eax=0x1c004122 ebx=0x01c0003f ecx=0x0000003f edx=0x00000000
   0x00000004 0x02: eax=0x1c004143 ebx=0x01c0003f ecx=0x000001ff edx=0x00000000
   0x00000004 0x03: eax=0x1c03c163 ebx=0x02c0003f ecx=0x00000fff edx=0x00000006
   0x00000004 0x04: eax=0x00000000 ebx=0x00000000 ecx=0x00000000 edx=0x00000000
   0x00000005 0x00: eax=0x00000040 ebx=0x00000040 ecx=0x00000003 edx=0x00021120
   0x00000006 0x00: eax=0x00000075 ebx=0x00000002 ecx=0x00000009 edx=0x00000000
   0x00000007 0x00: eax=0x00000000 ebx=0x00000281 ecx=0x00000000 edx=0x9c000400
   0x00000008 0x00: eax=0x00000000 ebx=0x00000000 ecx=0x00000000 edx=0x00000000
   0x00000009 0x00: eax=0x00000000 ebx=0x00000000 ecx=0x00000000 edx=0x00000000
   0x0000000a 0x00: eax=0x07300403 ebx=0x00000000 ecx=0x00000000 edx=0x00000603
   0x0000000b 0x00: eax=0x00000001 ebx=0x00000002 ecx=0x00000100 edx=0x00000001
   0x0000000b 0x01: eax=0x00000004 ebx=0x00000004 ecx=0x00000201 edx=0x00000001
   0x0000000b 0x02: eax=0x00000000 ebx=0x00000000 ecx=0x00000002 edx=0x00000001
   0x0000000c 0x00: eax=0x00000000 ebx=0x00000000 ecx=0x00000000 edx=0x00000000
   0x0000000d 0x00: eax=0x00000007 ebx=0x00000340 ecx=0x00000340 edx=0x00000000
   0x0000000d 0x01: eax=0x00000001 ebx=0x00000000 ecx=0x00000000 edx=0x00000000
   0x0000000d 0x02: eax=0x00000100 ebx=0x00000240 ecx=0x00000000 edx=0x00000000
   0x20000000 0x00: eax=0x00000007 ebx=0x00000340 ecx=0x00000340 edx=0x00000000
   0x80000000 0x00: eax=0x80000008 ebx=0x00000000 ecx=0x00000000 edx=0x00000000
   0x80000001 0x00: eax=0x00000000 ebx=0x00000000 ecx=0x00000001 edx=0x28100800
   0x80000002 0x00: eax=0x20202020 ebx=0x49202020 ecx=0x6c65746e edx=0x20295228
   0x80000003 0x00: eax=0x65726f43 ebx=0x294d5428 ecx=0x2d336920 edx=0x37313233
   0x80000004 0x00: eax=0x50432055 ebx=0x20402055 ecx=0x30382e31 edx=0x007a4847
   0x80000005 0x00: eax=0x00000000 ebx=0x00000000 ecx=0x00000000 edx=0x00000000
   0x80000006 0x00: eax=0x00000000 ebx=0x00000000 ecx=0x01006040 edx=0x00000000
   0x80000007 0x00: eax=0x00000000 ebx=0x00000000 ecx=0x00000000 edx=0x00000100
   0x80000008 0x00: eax=0x00003024 ebx=0x00000000 ecx=0x00000000 edx=0x00000000
   0x80860000 0x00: eax=0x00000007 ebx=0x00000340 ecx=0x00000340 edx=0x00000000
   0xc0000000 0x00: eax=0x00000007 ebx=0x00000340 ecx=0x00000340 edx=0x00000000
CPU 2:
   0x00000000 0x00: eax=0x0000000d ebx=0x756e6547 ecx=0x6c65746e edx=0x49656e69
   0x00000001 0x00: eax=0x000306a9 ebx=0x02100800 ecx=0x3dbae3bf edx=0xbfebfbff
   0x00000002 0x00: eax=0x76035a01 ebx=0x00f0b2ff ecx=0x00000000 edx=0x00ca0000
   0x00000003 0x00: eax=0x00000000 ebx=0x00000000 ecx=0x00000000 edx=0x00000000
   0x00000004 0x00: eax=0x1c004121 ebx=0x01c0003f ecx=0x0000003f edx=0x00000000
   0x00000004 0x01: eax=0x1c004122 ebx=0x01c0003f ecx=0x0000003f edx=0x00000000
   0x00000004 0x02: eax=0x1c004143 ebx=0x01c0003f ecx=0x000001ff edx=0x00000000
   0x00000004 0x03: eax=0x1c03c163 ebx=0x02c0003f ecx=0x00000fff edx=0x00000006
   0x00000004 0x04: eax=0x00000000 ebx=0x00000000 ecx=0x00000000 edx=0x00000000
   0x00000005 0x00: eax=0x00000040 ebx=0x00000040 ecx=0x00000003 edx=0x00021120
   0x00000006 0x00: eax=0x00000075 ebx=0x00000002 ecx=0x00000009 edx=0x00000000
   0x00000007 0x00: eax=0x00000000 ebx=0x00000281 ecx=0x00000000 edx=0x9c000400
   0x00000008 0x00: eax=0x00000000 ebx=0x00000000 ecx=0x00000000 edx=0x00000000
   0x00000009 0x00: eax=0x00000000 ebx=0x00000000 ecx=0x00000000 edx=0x00000000
   0x0000000a 0x00: eax=0x07300403 ebx=0x00000000 ecx=0x00000000 edx=0x00000603
   0x0000000b 0x00: eax=0x00000001 ebx=0x00000002 ecx=0x00000100 edx=0x00000002
   0x0000000b 0x01: eax=0x00000004 ebx=0x00000004 ecx=0x00000201 edx=0x00000002
   0x0000000b 0x02: eax=0x00000000 ebx=0x00000000 ecx=0x00000002 edx=0x00000002
   0x0000000c 0x00: eax=0x00000000 ebx=0x00000000 ecx=0x00000000 edx=0x00000000
   0x0000000d 0x00: eax=0x00000007 ebx=0x00000340 ecx=0x00000340 edx=0x00000000
   0x0000000d 0x01: eax=0x00000001 ebx=0x00000000 ecx=0x00000000 edx=0x00000000
   0x0000000d 0x02: eax=0x00000100 ebx=0x00000240 ecx=0x00000000 edx=0x00000000
   0x20000000 0x00: eax=0x00000007 ebx=0x00000340 ecx=0x00000340 edx=0x00000000
   0x80000000 0x00: eax=0x80000008 ebx=0x00000000 ecx=0x00000000 edx=0x00000000
   0x80000001 0x00: eax=0x00000000 ebx=0x00000000 ecx=0x00000001 edx=0x28100800
   0x80000002 0x00: eax=0x20202020 ebx=0x49202020 ecx=0x6c65746e edx=0x20295228
   0x80000003 0x00: eax=0x65726f43 ebx=0x294d5428 ecx=0x2d336920 edx=0x37313233
   0x80000004 0x00: eax=0x50432055 ebx=0x20402055 ecx=0x30382e31 edx=0x007a4847
   0x80000005 0x00: eax=0x00000000 ebx=0x00000000 ecx=0x00000000 edx=0x00000000
   0x80000006 0x00: eax=0x00000000 ebx=0x00000000 ecx=0x01006040 edx=0x00000000
   0x80000007 0x00: eax=0x00000000 ebx=0x00000000 ecx=0x00000000 edx=0x00000100
   0x80000008 0x00: eax=0x00003024 ebx=0x00000000 ecx=0x00000000 edx=0x00000000
   0x80860000 0x00: eax=0x00000007 ebx=0x00000340 ecx=0x00000340 edx=0x00000000
   0xc0000000 0x00: eax=0x00000007 ebx=0x00000340 ecx=0x00000340 edx=0x00000000
CPU 3:
   0x00000000 0x00: eax=0x0000000d ebx=0x756e6547 ecx=0x6c65746e edx=0x49656e69
   0x00000001 0x00: eax=0x000306a9 ebx=0x03100800 ecx=0x3dbae3bf edx=0xbfebfbff
   0x00000002 0x00: eax=0x76035a01 ebx=0x00f0b2ff ecx=0x00000000 edx=0x00ca0000
   0x00000003 0x00: eax=0x00000000 ebx=0x00000000 ecx=0x00000000 edx=0x00000000
   0x00000004 0x00: eax=0x1c004121 ebx=0x01c0003f ecx=0x0000003f edx=0x00000000
   0x00000004 0x01: eax=0x1c004122 ebx=0x01c0003f ecx=0x0000003f edx=0x00000000
   0x00000004 0x02: eax=0x1c004143 ebx=0x01c0003f ecx=0x000001ff edx=0x00000000
   0x00000004 0x03: eax=0x1c03c163 ebx=0x02c0003f ecx=0x00000fff edx=0x00000006
   0x00000004 0x04: eax=0x00000000 ebx=0x00000000 ecx=0x00000000 edx=0x00000000
   0x00000005 0x00: eax=0x00000040 ebx=0x00000040 ecx=0x00000003 edx=0x00021120
   0x00000006 0x00: eax=0x00000075 ebx=0x00000002 ecx=0x00000009 edx=0x00000000
   0x00000007 0x00: eax=0x00000000 ebx=0x00000281 ecx=0x00000000 edx=0x9c000400
   0x00000008 0x00: eax=0x00000000 ebx=0x00000000 ecx=0x00000000 edx=0x00000000
   0x00000009 0x00: eax=0x00000000 ebx=0x00000000 ecx=0x00000000 edx=0x00000000
   0x0000000a 0x00: eax=0x07300403 ebx=0x00000000 ecx=0x00000000 edx=0x00000603
   0x0000000b 0x00: eax=0x00000001 ebx=0x00000002 ecx=0x00000100 edx=0x00000003
   0x0000000b 0x01: eax=0x00000004 ebx=0x00000004 ecx=0x00000201 edx=0x00000003
   0x0000000b 0x02: eax=0x00000000 ebx=0x00000000 ecx=0x00000002 edx=0x00000003
   0x0000000c 0x00: eax=0x00000000 ebx=0x00000000 ecx=0x00000000 edx=0x00000000
   0x0000000d 0x00: eax=0x00000007 ebx=0x00000340 ecx=0x00000340 edx=0x00000000
   0x0000000d 0x01: eax=0x00000001 ebx=0x00000000 ecx=0x00000000 edx=0x00000000
   0x0000000d 0x02: eax=0x00000100 ebx=0x00000240 ecx=0x00000000 edx=0x00000000
   0x20000000 0x00: eax=0x00000007 ebx=0x00000340 ecx=0x00000340 edx=0x00000000
   0x80000000 0x00: eax=0x80000008 ebx=0x00000000 ecx=0x00000000 edx=0x00000000
   0x80000001 0x00: eax=0x00000000 ebx=0x00000000 ecx=0x00000001 edx=0x28100800
   0x80000002 0x00: eax=0x20202020 ebx=0x49202020 ecx=0x6c65746e edx=0x20295228
   0x80000003 0x00: eax=0x65726f43 ebx=0x294d5428 ecx=0x2d336920 edx=0x37313233
   0x80000004 0x00: eax=0x50432055 ebx=0x20402055 ecx=0x30382e31 edx=0x007a4847
   0x80000005 0x00: eax=0x00000000 ebx=0x00000000 ecx=0x00000000 edx=0x00000000
   0x80000006 0x00: eax=0x00000000 ebx=0x00000000 ecx=0x01006040 edx=0x00000000
   0x80000007 0x00: eax=0x00000000 ebx=0x00000000 ecx=0x00000000 edx=0x00000100
   0x80000008 0x00: eax=0x00003024 ebx=0x00000000 ecx=0x00000000 edx=0x00000000
   0x80860000 0x00: eax=0x00000007 ebx=0x00000340 ecx=0x00000340 edx=0x00000000
   0xc0000000 0x00: eax=0x00000007 ebx=0x00000340 ecx=0x00000340 edx=0x00000000
